"q_id";"q_title";"q_active"
"P137";"Which one of the following is NOT required inorder to come up with a project estimate?";"Y"
"P138";"All of the following are examples of the cost of nonconformance EXCEPT";"Y"
"P139";"All the following are tools of Control Quality Except";"Y"
"P140";"Communication is key to the success of a project. You had 3 stake holders to whom you need to communicate. A new stake holder added to the project. How many more communication channels do you needs no";"Y"
"HAD100";"Which one of the following is not a main component of HBase?";"Y"
"HAD101";"HDFS files are designed for";"Y"
"HAD102";"What is PIG ?";"Y"
"HAD103";"When is the earliest point at which the reduce method of a given Reducer can be called?";"Y"
"HAD104";"Assuming default settings, which best describes the order of data provided to a reducer?s reduce method:";"Y"
"HAD105";"How are keys and values presented and passed to the reducers during a standard sort and shuffle phase of MapReduce?";"Y"
"HAD106";"You are developing a combiner that takes as input Text keys, IntWritable values, and emits Text keys, IntWritable values. Which interface should your class implement?";"Y"
